{
    "weekday_date_ranges": [
      {
        "name": "date_array_1",
        "ranges": [
            {"start": "2024-04-15", "end": "2024-04-22"},
            {"start": "2024-04-29", "end": "2024-04-30"},
            {"start": "2024-05-02", "end": "2024-05-03"},
            {"start": "2024-05-21", "end": "2024-05-24"},
            {"start": "2024-05-27", "end": "2024-05-31"},
            {"start": "2024-06-03", "end": "2024-06-07"}
          ]
      },
      {
        "name": "date_array_2",
        "ranges": [
            {"start": "2024-04-24", "end": "2024-04-26"}
          ]
      },
      {
        "name": "date_array_3",
        "ranges": [
            {"start": "2024-05-01", "end": "2024-05-01"}
          ]
      },
      {
        "name": "date_array_4",
        "ranges": [
            {"start": "2024-05-06", "end": "2024-05-10"}
          ]
      },
      {
        "name": "date_array_5",
        "ranges": [
            {"start": "2024-05-11", "end": "2024-05-11"},
            {"start": "2024-05-13", "end": "2024-05-17"},
            {"start": "2024-06-10", "end": "2024-06-14"},
            {"start": "2024-06-17", "end": "2024-06-18"},
            {"start": "2024-06-21", "end": "2024-06-21"},
            {"start": "2024-06-24", "end": "2024-06-28"},
            {"start": "2024-07-01", "end": "2024-07-05"},
            {"start": "2024-07-15" , "end":"2024-07-16"}
          ]
      },
    
    {
        "name": "date_array_7", 
        "ranges": [
            {"start": "2024-05-20", "end": "2024-05-20"}          
          ]
      },
  
      {
          "name": "date_array_8", 
          "ranges": [
              {"start": "2024-07-23", "end": "2024-07-23"}          
            ]
        },
        {
            "name": "date_array_9", 
            "ranges": [
                {"start": "2024-07-22", "end": "2024-07-22"},
                {"start": "2025-08-01", "end": "2025-08-01"}
              ]
          },
          {
              "name": "date_array_10", 
              "ranges": [
                  {"start": "2024-07-24", "end": "2024-07-26"},
                  {"start": "2024-12-06", "end": "2024-12-06"}          
                ]
            },
            {
              "name": "date_array_11", 
              "ranges": [
                  {"start": "2024-07-30", "end": "2024-07-30"} ,
                  {"start": "2024-10-22", "end": "2024-10-24"}       
                ]
            },
            {
              "name": "date_array_12", 
              "ranges": [
                  {"start": "2024-08-01", "end": "2024-08-02"},
                  {"start": "2025-06-17", "end": "2025-06-17"}
                ]
            },
            {
              "name": "date_array_16",
              "ranges": [
                {"start": "2024-10-08", "end": "2024-10-08"}
              ]
            },
            {
              "name":"date_array_18",
              "ranges": [
                {"start": "2024-10-15", "end": "2024-10-16"}
              ]
            },
            {
              "name":"date_array_19",
              "ranges": [
                {"start": "2024-10-14", "end": "2024-10-14"}
              ]
            },
            {
              "name":"date_array_20",
              "ranges": [
                {"start": "2024-10-21", "end": "2024-10-21"},
                {"start": "2024-12-02", "end": "2024-12-03"}
              ]
            },
            {
              "name": "date_array_23",
              "ranges": [
                  {"start": "2024-12-08", "end": "2024-12-08"}
                ]
            },
            {
              "name": "date_array_24",
              "ranges": [
                  {"start": "2024-12-09", "end": "2024-12-10"}
                ]
            },
            {
              "name":"date_array_25",
              "ranges": [
                {"start": "2024-12-12", "end": "2024-12-14"}
              ]
            },
            {
              "name":"date_array_26",
              "ranges": [
                {"start": "2024-12-25", "end": "2024-12-25"},
                {"start": "2025-01-04", "end": "2025-01-04"}
              ]
            },
            {
              "name":"date_array_27",
              "ranges": [
                {"start": "2025-01-03", "end": "2025-01-03"}
              ]
            },
            {
              "name":"date_array_28",
              "ranges": [
                {"start": "2025-01-09", "end": "2025-01-09"}
              ]
            },
            {
              "name":"date_array_29",
              "ranges": [
                {"start": "2025-02-13", "end": "2025-02-13"}
              ]
            },
            {
              "name":"date_array_30",
              "ranges":[
                {"start": "2025-02-14", "end": "2025-02-14"}
              ]
            },
            {
              "name":"date_array_31",
              "ranges":[
                {"start": "2025-03-14", "end": "2025-03-14"}
              ]
            },
            {
              "name": "Mahashivrati-25",
              "ranges": [
                {"start": "2025-02-26", "end": "2025-02-26"}
              ]
            },
            {
              "name": "Holi-25",
              "ranges": [
                {"start": "2025-03-14", "end": "2025-03-14"}
              ]
            },
            {
              "name": "AmbedkarJayanti-25",
              "ranges": [
                {"start": "2025-04-14", "end": "2025-04-14"}
              ]
            },
            {
              "name": "BuddhaPurnima-25",
              "ranges": [
                {"start": "2025-05-12", "end": "2025-05-12"}
              ]
            },
            {
              "name": "IndependenceDay-25",
              "ranges": [
                {"start": "2025-08-15", "end": "2025-08-15"}
              ]
            },
            {
              "name": "26-10-25",
              "ranges": [
                {"start": "2025-10-26", "end": "2025-10-26"}
              ]
            },
            {
              "name": "27-10-25",
              "ranges": [
                {"start": "2025-10-27", "end": "2025-10-27"}
              ]
            },
            {
              "name": "28-10-25",
              "ranges": [
                {"start": "2025-10-28", "end": "2025-10-28"}
              ]
            },
            {
              "name": "29-10-25",
              "ranges": [
                {"start": "2025-10-29", "end": "2025-10-29"}
              ]
            },
            {
              "name": "05-11-25",
              "ranges": [
                {"start": "2025-11-05", "end": "2025-11-05"}
              ]
            },
            {
              "name": "27-11-25",
              "ranges": [
                {"start": "2025-11-27", "end": "2025-11-27"}
              ]
            },
            {
              "name": "28-11-25",
              "ranges": [
                {"start": "2025-11-28", "end": "2025-11-28"}
              ]
            },
            {
              "name": "01-12-25",
              "ranges": [
                {"start": "2025-12-01", "end": "2025-12-01"}
              ]
            },
            {
              "name": "02-12-25",
              "ranges": [
                {"start": "2025-12-02", "end": "2025-12-02"}
              ]
            },
            {
              "name": "03-12-25",
              "ranges": [
                {"start": "2025-12-03", "end": "2025-12-03"}
              ]
            },
            {
              "name": "IN27-10-25",
              "ranges": [
                {"start": "2025-10-27", "end": "2025-10-27"}
              ]
            },
            {
              "name": "IN28-10-25",
              "ranges": [
                {"start": "2025-10-28", "end": "2025-10-28"}
              ]
            },
            {
              "name": "IN29-10-25",
              "ranges": [
                {"start": "2025-10-29", "end": "2025-10-29"}
              ]
            },
            {
              "name":"IN12-12-25",
              "ranges": [
                {"start": "2025-12-12", "end": "2025-12-12"}
              ]
            },
            {
              "name": "date_04122025",
              "ranges": [
                {"start": "2025-12-04", "end": "2025-12-04"}
              ]
            },
            {
              "name": "date_05122025",
              "ranges": [
                {"start": "2025-12-05", "end": "2025-12-05"}
              ]
            },
            {
              "name": "date_12122025",
              "ranges": [
                {"start": "2025-12-12", "end": "2025-12-12"}
              ]
            }

    ],
    "weekend_date_ranges": [
      {
        "name": "date_array_6",
        "ranges": [
            {"start": "2024-04-27", "end": "2024-04-28"},
            {"start": "2024-08-07", "end": "2024-08-07"},
            {"start": "2024-08-18", "end": "2024-08-18"},
            {"start": "2024-10-05" ,"end": "2024-10-05"},
            {"start": "2024-12-27" ,"end": "2024-12-27"},
            {"start": "2024-12-28" ,"end": "2024-12-29"},
            {"start": "2025-04-15" ,"end": "2025-04-15"}
          ]
      },
      {
        "name": "date_sunday",
        "ranges": [
            {"start": "2024-05-05", "end": "2024-05-05"},
            {"start": "2024-05-12", "end": "2024-05-12"},
            {"start": "2024-05-18", "end": "2024-05-18"},
            {"start": "2024-05-19", "end": "2024-05-19"},
            {"start": "2024-05-25", "end": "2024-05-25"},
            {"start": "2024-05-26", "end": "2024-05-26"},
            {"start": "2024-06-15", "end": "2024-06-16"},
            {"start": "2024-06-22", "end": "2024-06-23"},
            {"start": "2024-06-30", "end": "2024-06-30"},
            {"start": "2024-07-06", "end": "2024-07-07"},
            {"start": "2024-07-14", "end": "2024-07-14"},
            {"start": "2024-07-21", "end": "2024-07-21"},
            {"start": "2024-07-28", "end": "2024-07-28"},
            {"start": "2024-12-04", "end": "2024-12-05"}
          ]
      },
      {
        "name": "date_array",
        "ranges": [
            {"start": "2024-04-20", "end": "2024-04-21"},
            {"start": "2024-05-04", "end": "2024-05-04"},
            {"start": "2024-06-01", "end": "2024-06-02"},
            {"start": "2024-06-08", "end": "2024-06-09"},
            {"start": "2024-10-02", "end": "2024-10-02"}
          ]
      },
      {
        "name": "date_array_13",
        "ranges": [
            {"start": "2024-08-03", "end": "2024-08-03"},
            {"start": "2025-01-05", "end": "2025-01-05"}
          ]
      },
      {
        "name": "date_array_14",
        "ranges": [
            {"start": "2024-08-04", "end": "2024-08-04"}
          ]
      },
      {
        "name": "date_array_15",
        "ranges": [
            {"start": "2024-10-06", "end": "2024-10-06"}
          ]
      },
      {
        "name": "date_array_17",
        "ranges": [
            {"start": "2024-10-10", "end": "2024-10-10"}
          ]
      },
      {
        "name": "date_array_21",
        "ranges": [
            {"start": "2024-10-26", "end": "2024-10-26"}
          ]
      },
      {
        "name": "date_array_22",
        "ranges": [
            {"start": "2024-10-27", "end": "2024-10-27"}
          ]
      }
      
    ],
    "rules": [
      {
        "date_array": "date_array_1",
        "adjustments": [
          {"range": [0, 35], "increment": 30},
          {"range": [36, 36], "increment": 40},
          {"range": [37, 37], "increment": 45},
          {"range": [38, 72], "increment": 60},
          {"range": [73, 73], "increment": 50},
          {"range": [74, 74], "increment": 45},
          {"range": [75, 75], "increment": 35},
          {"range": [76, 95], "increment": 30}
        ]
      },
      {
        "date_array": "date_array_2",
        "adjustments": [
          {"range": [0, 35], "increment": 20},
          {"range": [36, 36], "increment": 30},
          {"range": [37, 37], "increment": 37},
          {"range": [38, 72], "increment": 50},
          {"range": [73, 73], "increment": 40},
          {"range": [74, 74], "increment": 37},
          {"range": [75, 75], "increment": 25},
          {"range": [76, 95], "increment": 25}
        ]
      },
      {
        "date_array": "date_array_6",
        "adjustments": [
          {"range": [0, 35], "increment": 5},
          {"range": [36, 36], "increment": 10},
          {"range": [37, 37], "increment": 10},
          {"range": [38, 72], "increment": 15},
          {"range": [73, 73], "increment": 10},
          {"range": [74, 74], "increment": 10},
          {"range": [75, 75], "increment": 10},
          {"range": [76, 95], "increment": 10}
        ]
      },
      {
        "date_array": "date_array_3",
        "adjustments": [
          {"range": [0, 35], "increment": 30},
          {"range": [36, 36], "increment": 30},
          {"range": [37, 37], "increment": 30},
          {"range": [38, 72], "increment": 40},
          {"range": [73, 73], "increment": 30},
          {"range": [74, 74], "increment": 30},
          {"range": [75, 75], "increment": 30},
          {"range": [76, 95], "increment": 35}
        ]
      },
      {
        "date_array": "date_sunday",
        "adjustments": [
          {"range": [0, 35], "increment": 20},
          {"range": [36, 36], "increment": 26},
          {"range": [37, 37], "increment": 26},
          {"range": [38, 72], "increment": 25},
          {"range": [73, 73], "increment": 26},
          {"range": [74, 74], "increment": 26},
          {"range": [75, 75], "increment": 26},
          {"range": [76, 95], "increment": 24}
        ]
      },
      {
        "date_array": "date_array",
        "adjustments": [
          {"range": [0, 35], "increment": 30},
          {"range": [36, 36], "increment": 40},
          {"range": [37, 37], "increment": 45},
          {"range": [38, 72], "increment": 60},
          {"range": [73, 73], "increment": 50},
          {"range": [74, 74], "increment": 45},
          {"range": [75, 75], "increment": 35},
          {"range": [76, 95], "increment": 30}
        ]
      },
      {
        "date_array": "date_array_4",
        "adjustments": [
          {"range": [0, 35], "increment": 30},
          {"range": [36, 36], "increment": 40},
          {"range": [37, 37], "increment": 45},
          {"range": [38, 72], "increment": 60},
          {"range": [73, 73], "increment": 50},
          {"range": [74, 74], "increment": 45},
          {"range": [75, 75], "increment": 35},
          {"range": [76, 95], "increment": 30}
        ]
      },
      {
        "date_array": "date_array_7",
        "adjustments": [
          {"range": [0, 35], "increment": 40},
          {"range": [36, 36], "increment": 35},
          {"range": [37, 37], "increment": 35},
          {"range": [38, 72], "increment": 30},
          {"range": [73, 73], "increment": 30},
          {"range": [74, 74], "increment": 30},
          {"range": [75, 75], "increment": 30},
          {"range": [76, 95], "increment": 35}
        ]
      },
      {
        "date_array": "date_array_5",
        "adjustments": [
          {"range": [0, 35], "increment": 20},
          {"range": [36, 36], "increment": 35},
          {"range": [37, 37], "increment": 35},
          {"range": [38, 72], "increment": 40},
          {"range": [73, 73], "increment": 40},
          {"range": [74, 74], "increment": 35},
          {"range": [75, 75], "increment": 35},
          {"range": [76, 95], "increment": 20}
        ]
      },
      {
        "date_array": "date_array_8",
        "adjustments": [
        {"range": [0, 35], "increment": 20},
        {"range": [36, 36], "increment": 40},
        {"range": [37, 37], "increment": 45},
        {"range": [38, 72], "increment": 60},
        {"range": [73, 73], "increment": 50},
        {"range": [74, 74], "increment": 45},
        {"range": [75, 75], "increment": 35},
        {"range": [76, 95], "increment": 30}
      ]
      },
      {
        "date_array": "date_array_9",
        "adjustments": [
        {"range": [0, 20], "increment": 5},
        {"range": [21, 35], "increment": 8},
        {"range": [36, 36], "increment": 25},
        {"range": [37, 37], "increment": 25},
        {"range": [38, 72], "increment": 40},
        {"range": [73, 73], "increment": 40},
        {"range": [74, 74], "increment": 35},
        {"range": [75, 75], "increment": 35},
        {"range": [76, 95], "increment": 27}
      ]
      },
      {
        "date_array": "date_array_10",
        "adjustments": [
        {"range": [0, 20], "increment": 8},
        {"range": [21, 35], "increment": 15},
        {"range": [36, 36], "increment": 15},
        {"range": [37, 37], "increment": 15},
        {"range": [38, 54], "increment": 10},
        {"range": [55, 73], "increment": 2},
        {"range": [74, 74], "increment": 5},
        {"range": [75, 75], "increment": 5},
        {"range": [76, 95], "increment": 5}
      ]
      },
      {
        "date_array": "date_array_11",
        "adjustments": [
          {"range": [0, 20], "increment": 10},
          {"range": [21, 30], "increment": 20},
          {"range": [31, 36], "increment": 20},
          {"range": [37, 37], "increment": 25},
          {"range": [38, 54], "increment": 35},
          {"range": [55, 73], "increment": 25},
          {"range": [74, 74], "increment": 20},
          {"range": [75, 75], "increment": 20},
          {"range": [76, 95], "increment": 10}
        ]
      },
      {
        "date_array": "date_array_12",
        "adjustments": [
          {"range": [0, 20], "increment": 11},
          {"range": [21, 35], "increment": 20},
          {"range": [36, 36], "increment": 20},
          {"range": [37, 37], "increment": 20},
          {"range": [38, 54], "increment": 20},
          {"range": [55, 73], "increment": 10},
          {"range": [74, 74], "increment": 8},
          {"range": [75, 75], "increment": 10},
          {"range": [76, 95], "increment": 8}
        ]
      },
      {
        "date_array": "date_array_13",
        "adjustments": [
        {"range": [0, 20], "increment": -10},
        {"range": [21, 30], "increment": -5},
        {"range": [31, 36], "increment": 0},
        {"range": [45, 54], "increment": -5},
        {"range": [55, 95], "increment": -10},
        {"range": [55, 73], "increment": 0},
        {"range": [74, 74], "increment": 0},
        {"range": [75, 75], "increment": 0},
        {"range": [76, 95], "increment": 0}
        ]
      },
      {
        "date_array": "date_array_14",
        "adjustments": [
        {"range": [0, 12], "increment": 0},
        {"range": [13, 18], "increment": 4},
        {"range": [19, 20], "increment": 5},
        {"range": [21, 24], "increment": 12},
        {"range": [25, 30], "increment": 15},
        {"range": [31, 35], "increment": 18},
        {"range": [36, 40], "increment": 20},
        {"range": [41, 55], "increment": 23},
        {"range": [56, 70], "increment": 15},
        {"range": [56, 95], "increment": 18}

        ]
      },
      {
        "date_array": "date_array_15",
        "adjustments": [
        {"range": [0, 30], "increment": 20},
        {"range": [31, 72], "increment": 0},
        {"range": [73, 96], "increment":10}
        ]
      },
      {
        "date_array": "date_array_16",
        "adjustments": [
        {"range": [0, 25], "increment": 0},
        {"range": [26, 30], "increment": 4},
        {"range": [31, 32], "increment": 5},
        {"range": [33, 40], "increment":15},
        {"range": [41, 96], "increment": 31}
        ]
      },
      {
        "date_array": "date_array_17",
        "adjustments": [
        {"range": [0, 43], "increment": 0},
        {"range": [44, 56], "increment": -5},
        {"range": [57, 96], "increment": -10}
        ]
      },
      {
        "date_array": "date_array_18",
        "adjustments": [
        {"range": [0, 19], "increment": 0},
        {"range": [20, 35], "increment": 10},
        {"range": [36, 42], "increment": 20},
        {"range": [43, 72], "increment": 22},
        {"range": [73, 77], "increment": 25},
        {"range": [78, 80], "increment": 15},
        {"range": [81, 96], "increment":5}
        ]
      },
      {
        "date_array": "date_array_19",
        "adjustments": [
        {"range": [0, 25], "increment": 5},
        {"range": [27, 40], "increment": 15},
        {"range": [40, 55], "increment": 25},
        {"range": [56, 70], "increment": 20},
        {"range": [71, 80], "increment": 10},
        {"range": [81, 96], "increment":2}
        ]
      },
      {
        "date_array": "date_array_20",
        "adjustments": [
          {"range": [0, 12], "increment": 0},
          {"range": [13, 18], "increment": 4},
          {"range": [19, 20], "increment": 5},
          {"range": [21, 24], "increment": 12},
          {"range": [25, 30], "increment": 15},
          {"range": [31, 35], "increment": 18},
          {"range": [36, 40], "increment": 20},
          {"range": [41, 55], "increment": 23},
          {"range": [56, 60], "increment": 15},
          {"range": [61, 61], "increment": 25},
          {"range": [62, 70], "increment": 15},
          {"range": [56, 95], "increment": 18}
          
        ]
      },
      {
        "date_array": "date_array_21",
        "adjustments": [
          {"range": [0, 38], "increment": -13},
          {"range": [39, 39] , "increment":-4},
          {"range": [40, 43], "increment": -22},
          {"range": [44, 45], "increment": -18},
          {"range": [46, 47], "increment": -20},
          {"range": [48, 49], "increment": -19},
          {"range": [50, 51], "increment": -18},
          {"range": [52, 53], "increment": -4},
          {"range": [54, 56], "increment": -12},
          {"range": [57, 58], "increment": -15},
          {"range": [59, 60], "increment": -18},
          {"range": [61, 63], "increment": -13},
          {"range": [64, 65], "increment": -15},
          {"range": [66, 67], "increment": -17},
          {"range": [68, 69], "increment": -19},
          {"range": [70, 70], "increment": -14},
          {"range": [71, 72], "increment": -5},
          {"range": [73, 74], "increment": 5},
          {"range": [75, 81], "increment": 0},
          {"range": [82, 85], "increment": -8},
          {"range": [86, 86], "increment": -10},
          {"range": [87, 89], "increment": -15},
          {"range": [90, 91], "increment": -20},
          {"range": [92, 95], "increment": -25}
        ]
      },
      {
        "date_array": "date_array_22",
        "adjustments": [
          {"range": [0, 36], "increment": -15},
          {"range": [37,48 ], "increment": -17},
          {"range": [49, 86], "increment": 0},
          {"range": [87, 95], "increment":-16}
        ]
      },
      {
        "date_array": "date_array_23",
        "adjustments": [
          {"range": [0, 36], "increment": -15},
          {"range": [37,48], "increment": -20},
          {"range": [49,60], "increment": -25},
          {"range": [61, 86], "increment":-30},
          {"range": [87, 95], "increment":-25}
        ]
      },
      {
        "date_array": "date_array_24",
        "adjustments": [
          {"range": [0, 36], "increment": -15},
          {"range": [37,48], "increment": -18},
          {"range": [49,60], "increment": -15},
          {"range": [61, 86], "increment":-20},
          {"range": [87, 95], "increment":-22}
        ]
      },
      {
        "date_array": "date_array_25",
        "adjustments": [
          {"range": [0, 24], "increment": 0},
          {"range": [25,75], "increment": 14},
          {"range": [76,95], "increment": 16}
        ]
      },
      {
        "date_array": "date_array_26",
        "adjustments": [
          {"range": [0, 24], "increment": -16},
          {"range": [25,95], "increment": -20}
        ]
      },
      {
        "date_array": "date_array_27",
        "adjustments": [
          {"range": [0, 30], "increment": -40},
          {"range": [31,40], "increment": -46},
          {"range": [41,72], "increment": -55},
          {"range": [73,90], "increment": -50},
          {"range": [91,95], "increment": -54}
        ]
      },
      {
        "date_array": "date_array_28",
        "adjustments": [
          {"range": [0, 12], "increment": -20},
          {"range": [13,17], "increment": -15},
          {"range": [18,41], "increment": 0},
          {"range": [42,68], "increment": -10},
          {"range": [69,88], "increment": 0},
          {"range": [89,95], "increment": -10}
        ]
      },
      {
        "date_array": "date_array_29",
        "adjustments": [
          {"range": [0, 20], "increment": -10},
          {"range": [21,25], "increment": -8},
          {"range": [26,30], "increment": -5},
          {"range": [31,44], "increment": 0},
          {"range": [45,65], "increment": 5},
          {"range": [66,95], "increment": 0}
        ]
      },
      {
        "date_array": "date_array_30",
        "adjustments": [
          {"range": [0, 10], "increment": -19},
          {"range": [11,15], "increment": -17},
          {"range": [16,19], "increment": -15},
          {"range": [20,22], "increment": -12},
          {"range": [23,25], "increment": -9},
          {"range": [26,86], "increment": 0},
          {"range": [87,95], "increment": -4}
        ]
      },
      {
        "date_array": "date_array_31",
        "adjustments": [
          {"range": [0, 0], "increment": -32.7907251},  
          {"range": [1, 1], "increment": -32.87516235},  
          {"range": [2, 2], "increment": -32.59989258},  
          {"range": [3, 3], "increment": -32.22099854},  
          {"range": [4, 4], "increment": -32.29868652},  
          {"range": [5, 5], "increment": -32.4020166},  
          {"range": [6, 6], "increment": -32.2727478},  
          {"range": [7, 7], "increment": -32.07572876},  
          {"range": [8, 8], "increment": -31.98628296},  
          {"range": [9, 9], "increment": -31.73240723},  
          {"range": [10, 10], "increment": -31.40967529},  
          {"range": [11, 11], "increment": -31.03473511},  
          {"range": [12, 12], "increment": -31.10154419},  
          {"range": [13, 13], "increment": -31.29991089},  
          {"range": [14, 14], "increment": -31.27171631},  
          {"range": [15, 15], "increment": -31.5227063},  
          {"range": [16, 16], "increment": -31.67727783},  
          {"range": [17, 17], "increment": -29.56190552},  
          {"range": [18, 18], "increment": -30.5060144},  
          {"range": [19, 19], "increment": -28.40716064},  
          {"range": [20, 20], "increment": -27.94082153},  
          {"range": [21, 21], "increment": -28.17444214},  
          {"range": [22, 22], "increment": -28.31755493},  
          {"range": [23, 23], "increment": -28.19145142},  
          {"range": [24, 24], "increment": -28.07001343},  
          {"range": [25, 25], "increment": -28.03345215},  
          {"range": [26, 26], "increment": -27.72731323},  
          {"range": [27, 27], "increment": -27.55252197},  
          {"range": [28, 28], "increment": -27.56293213},  
          {"range": [29, 29], "increment": -27.40216797},  
          {"range": [30, 30], "increment": -27.0296106},  
          {"range": [31, 31], "increment": -26.53794922},  
          {"range": [32, 32], "increment": -26.79576416},  
          {"range": [33, 33], "increment": -30.86585083},  
          {"range": [34, 34], "increment": -33.78111572},  
          {"range": [35, 35], "increment": -36.80144653},  
          {"range": [36, 36], "increment": -39.40515747},  
          {"range": [37, 37], "increment": -45.58982544},  
          {"range": [38, 38], "increment": -45.1765686},  
          {"range": [39, 39], "increment": -51.06134644},  
          {"range": [40, 40], "increment": -54.89890747},  
          {"range": [41, 41], "increment": -63.0395874},  
          {"range": [42, 42], "increment": -68.36151733},  
          {"range": [43, 43], "increment": -70.48670654},  
          {"range": [44, 44], "increment": -69.87199707},  
          {"range": [45, 45], "increment": -73.40681763},  
          {"range": [46, 46], "increment": -72.89570923},  
          {"range": [47, 47], "increment": -70.30890503},  
          {"range": [48, 48], "increment": -66.37253418},  
          {"range": [49, 49], "increment": -64.09862061},  
          {"range": [50, 50], "increment": -59.62684937},  
          {"range": [51, 51], "increment": -53.55756836},  
          {"range": [52, 52], "increment": -53.68289795},  
          {"range": [53, 53], "increment": -51.27719727},  
          {"range": [54, 54], "increment": -50.55805054},  
          {"range": [55, 55], "increment": -50.00664063},  
          {"range": [56, 56], "increment": -50.69335938},  
          {"range": [57, 57], "increment": -52.3406189},  
          {"range": [58, 58], "increment": -55.5628418},  
          {"range": [59, 59], "increment": -53.40526123},  
          {"range": [60, 60], "increment": -54.91600952},  
          {"range": [61, 61], "increment": -55.20443726},  
          {"range": [62, 62], "increment": -51.48864746},  
          {"range": [63, 63], "increment": -49.04559326},  
          {"range": [64, 64], "increment": -50.60473022},  
          {"range": [65, 65], "increment": -46.24476318},  
          {"range": [66, 66], "increment": -46.98845215},  
          {"range": [67, 67], "increment": -45.07116089},  
          {"range": [68, 68], "increment": -44.43681641},  
          {"range": [69, 69], "increment": -44.40266724},  
          {"range": [70, 70], "increment": -41.91159058},  
          {"range": [71, 71], "increment": -39.7661377},  
          {"range": [72, 72], "increment": -35.80109863},  
          {"range": [73, 73], "increment": -34.47610474},  
          {"range": [74, 74], "increment": -31.56707764},  
          {"range": [75, 75], "increment": -29.95059204},  
          {"range": [76, 76], "increment": -26.77564697},  
          {"range": [77, 77], "increment": -27.91932373},  
          {"range": [78, 78], "increment": -28.10682373},  
          {"range": [79, 79], "increment": -29.47120972},  
          {"range": [80, 80], "increment": -30.83327637},  
          {"range": [81, 81], "increment": -32.42435913},  
          {"range": [82, 82], "increment": -32.62590942},  
          {"range": [83, 83], "increment": -32.77805786},  
          {"range": [84, 84], "increment": -32.33450317},  
          {"range": [85, 85], "increment": -29.21288452},  
          {"range": [86, 86], "increment": -29.59336548},  
          {"range": [87, 87], "increment": -29.28743286},  
          {"range": [88, 88], "increment": -29.20648193},  
          {"range": [89, 89], "increment": -28.60751953},  
          {"range": [90, 90], "increment": -28.15327148},  
          {"range": [91, 91], "increment": -34.15957031},  
          {"range": [92, 92], "increment": -35.7166748},  
          {"range": [93, 93], "increment": -35.09364624},  
          {"range": [94, 94], "increment": -33.10635376},  
          {"range": [95, 95], "increment": -32.3001709}  
        ]
      },
      {
      "date_array": "date_04122025",
      "day_type": "Normal Day",
      "adjustments": [
        {"range": [0, 8], "increment": -10},
        {"range": [9,12], "increment": -8},
        {"range": [13,27], "increment": -7},
        {"range": [28,29], "increment": -8},
        {"range": [30,31], "increment": -9},
        {"range": [32,34], "increment": -11},
        {"range": [35,37], "increment": -14},
        {"range": [38,40], "increment": -15},
        {"range": [41,43], "increment": -16},
        {"range": [44,49], "increment": -17},
        {"range": [50,54], "increment": -16},
        {"range": [55,62], "increment": -15},
        {"range": [63,72], "increment": -13},
        {"range": [73,80], "increment": -11},
        {"range": [81,88], "increment": -10},
        {"range": [89,95], "increment": -9}
      ]
    },
    {
      "date_array": "date_05122025",
      "day_type": "Normal Day",
      "adjustments": [
        {"range": [0, 31], "increment": 0},
        {"range": [32,32], "increment": -5},
        {"range": [33,33], "increment": -7},
        {"range": [34,34], "increment": -10},
        {"range": [35,64], "increment": -15},
        {"range": [65,66], "increment": -12},
        {"range": [67,68], "increment": -10},
        {"range": [69,69], "increment": -8},
        {"range": [70,70], "increment": -9},
        {"range": [71,71], "increment": -7},
        {"range": [72,72], "increment": -5},
        {"range": [73,95], "increment": 0}
      ]
    },
    {
      "date_array": "date_12122025",
      "day_type": "Normal Day",
      "adjustments": [
        {"range": [0, 20], "increment": -10},
        {"range": [21,26], "increment": -9},
        {"range": [27,36], "increment": -8},
        {"range": [37,40], "increment": -10},
        {"range": [41,43], "increment": -16},
        {"range": [44,50], "increment": -19},
        {"range": [51,58], "increment": -20},
        {"range": [59,65], "increment": -17},
        {"range": [66,70], "increment": -15},
        {"range": [71,75], "increment": -14},
        {"range": [76,95], "increment": -10}
      ]
    },
      {
      "date_array": "Mahashivrati-25",
      "day_type": "Normal Day",
      "adjustments": [
        {
          "range": [0, 95],
          "replace": [
            350.57, 344.95, 342.03, 340.4, 334.51, 332.02, 327.25, 325.03, 322.33, 319.4,
            312.78, 312.28, 308.34, 306.63, 308.32, 306.17, 305.36, 305.99, 308.19, 308.88,
            310.57, 311.72, 314.23, 315.58, 323.0, 330.06, 336.85, 343.11, 352.33, 364.01,
            374.37, 384.0, 398.99, 411.03, 426.77, 440.74, 453.05, 461.74, 469.96, 479.17,
            483.17, 489.44, 492.52, 496.63, 499.09, 497.66, 497.97, 495.47, 495.06, 494.13,
            493.26, 492.7, 486.14, 484.54, 484.43, 483.88, 486.3, 488.65, 488.64, 490.57,
            489.82, 488.75, 487.66, 486.42, 487.7, 484.4, 479.95, 480.57, 477.98, 475.53,
            469.17, 465.5, 462.29, 454.3, 452.1, 450.92, 448.04, 441.37, 436.32, 430.15,
            423.96, 419.7, 413.71, 408.65, 405.64, 401.64, 397.76, 393.02, 384.85, 380.33,
            378.06, 372.02, 367.47, 361.62, 358.47, 354.02
          ]
        }
      ]
    },
    {
      "date_array": "Holi-25",
      "day_type": "Holiday",
      "adjustments": [
        {
          "range": [0, 95],
          "replace": [
            364.14, 362.26, 356.99, 353.64, 348.58, 342.54, 338.85, 334.24, 328.86, 324.86,
            322.07, 318.2, 315.25, 312.04, 308.0, 305.72, 303.77, 303.86, 302.14, 303.87,
            302.82, 301.61, 300.42, 300.29, 299.8, 299.53, 300.1, 300.77, 300.38, 303.07,
            306.09, 311.16, 316.0, 319.0, 322.0, 325.0, 326.0, 326.0, 332.0, 334.0, 336.0, 337.0,
            336.0, 338.0, 340.0, 340.0, 342.0, 345.0, 350.0, 352.0, 355.0, 360.0, 361.0, 363.0,
            365.0, 366.0, 366.0, 366.0, 365.0, 366.0, 368.0, 367.0, 368.0, 368.0, 366.0, 367.0,
            365.0, 366.0, 365.0, 364.0, 364.0, 364.0, 366.0, 367.0, 369.0, 371.0, 375.0, 377.0,
            378.0, 379.0, 378.0, 376.0, 375.0, 374.0, 373.0, 375.0, 374.0, 372.0, 371.0, 369.0,
            369.0, 365.0, 363.0, 361.0, 361.0, 356.0
          ]
        }
      ]
    },
    {
      "date_array": "AmbedkarJayanti-25",
      "day_type": "Normal Day",
      "adjustments": [
        {
          "range": [0, 95],
          "replace": [
            394.3, 390.31, 386.57, 381.4, 375.7866667, 370.3488889, 365.2977778, 360.7277778, 356.46, 352.3955556,
            348.5388889, 345.0844444, 342.2355556, 340.0111111, 338.1755556, 336.1388889, 334.1022222, 332.5877778, 332.2211111, 332.5,
            333.1755556, 334.0122222, 335.8577778, 339.2155556, 344.4411111, 351.2444444, 359.1633333, 368.5666667, 380.2933333, 394.5077778,
            410.9944444, 429.5674074, 449.5233333, 469.5362963, 486.6159259, 500.7581481, 512.1940741, 522.3040741, 530.9866667, 538.44,
            545.0196296, 550.7766667, 555.5474074, 559.0803704, 561.3714815, 562.8414815, 564.0422222, 565.5755556, 567.3188889, 568.9751852,
            569.7977778, 569.8025926, 569.5040741, 569.7137037, 570.9351852, 572.5903704, 574.2677778, 575.0437037, 575.0251852, 575.8477778,
            577.9403704, 581.2462963, 582.2081481, 580.9607407, 577.637037, 572.1851852, 570.3177778, 565.9511111, 560.8722222, 555.1840741,
            545.0081481, 539.3377778, 532.4322222, 528.3037037, 518.0548148, 512.6562963, 509.0262963, 505.8066667, 501.0433333, 495.24,
            490.0833333, 485.15, 480.51, 473.2966667, 460.7133333, 461.1433333, 458.91, 457.6366667, 454.42, 450.9966667, 445.8733333,
            441.86, 438.3433333, 435.14, 431.8833333, 428.09
          ]
        }
      ]
    },
    {
      "date_array": "BuddhaPurnima-25",
      "day_type": "Normal Day",
      "adjustments": [
        {
          "range": [0, 95],
          "replace": [
            414.79, 406.62, 404.91, 395.26, 388.12, 379.83, 374.02, 370.33, 366.2, 364.25,
            360.75, 353.79, 350.8, 347.27, 344.41, 345.13, 340.39, 340.25, 338.28, 337.66,
            337.81, 340.28, 344.1, 343.02, 355.41, 358.24, 367.68, 375.24, 385.26, 399.47,
            414.7, 433.13, 452.79, 473.36, 491.12, 508.13, 520.69, 534.22, 542.19, 551.63,
            558.22, 565.16, 574.14, 571.89, 577.1, 574.37, 574.01, 573.29, 573.76, 577.88,
            579.27, 577.1, 575.56, 575.31, 574.46, 576.4, 582.11, 591.2, 590.16, 594.37,
            590.29, 590.75, 590.1, 584.14, 576.38, 570.63, 566.36, 561.73, 560.92, 554.01,
            545.73, 538.72, 527.81, 517.12, 514.46, 510.16, 504.23, 497.92, 490.93, 486.06,
            476.14, 470.96, 467.43, 466.62, 463.44, 462.41, 456.18, 447.06, 447.01, 444.44,
            443.83, 440.49, 435.9, 431.19, 425.89, 422.02
          ]
        }
      ]
    },
    {
      "date_array": "IndependenceDay-25",
      "day_type": "Holiday",
      "adjustments": [
        {
          "range": [0, 95],
          "replace": [
            358.9307345, 357.4462876, 350.2365001, 347.8007572, 340.6453145,336.9235542, 333.4476179, 331.2007872, 326.1261314, 323.3272499,
            320.9538034, 319.9968113, 315.2254888, 313.2375832, 311.2114592,306.5192953, 306.24631, 305.3096787, 304.2101312, 306.1569098,
            307.6135355, 308.122918, 310.5619463, 311.4070631, 315.9164916,320.5861443, 326.1505614, 330.2290949, 337.3094312, 344.8794637,
            349.0516983, 354.0789088, 362.8170602, 370.5480695, 375.5304412,378.903042, 379.6013983, 381.1106888, 383.0741701, 385.6733657,
            386.8463844, 386.2637023, 386.8737333, 388.9123884, 391.6163386,394.3546624, 394.5274993, 394.2377862, 394.9746912, 394.9089081,394.6892062, 394.1016287, 392.8031669, 393.1674485, 393.6000253,392.4983299, 391.5026579, 390.6615836, 389.9813656, 386.2723866,
            385.7824085, 385.4565148, 383.7199404, 383.1958415, 381.9417804,380.2000139, 378.4407391, 377.6404837, 378.9721152, 379.1059029,379.6387449, 379.5229619, 380.7341807, 380.8953808, 384.1744306,
            387.9987477, 392.4060353, 392.6115672, 395.2266599, 390.5332834,390.5346467, 390.1457457, 390.2642455, 389.1091301, 386.5259325,385.7502039, 385.0325075, 384.3211117, 381.6473645, 378.9383486,376.7212771, 373.4204537, 371.8677157, 369.4692876, 365.8767691,361.5072184
        ]
        }
      ]
    },
    {
      "date_array": "26-10-25",
      "day_type": "Normal Day",
      "adjustments": [
        {
          "range": [0, 95],
          "replace":[
           385.0, 379.0, 375.0, 371.0, 366.0, 361.0, 357.0, 354.0, 350.0, 346.0, 343.0, 339.0, 336.0, 334.0, 331.0, 330.0,
            329.0, 327.0, 325.0, 326.0, 325.0, 326.0, 326.0, 327.0, 327.0, 332.0, 333.0, 336.0, 338.0, 342.0, 347.0, 353.0,
            359.0, 367.0, 375.0, 383.0, 391.0, 399.0, 406.0, 414.0, 420.0, 425.0, 429.0, 433.0, 435.0, 435.0, 437.0, 439.0,
            439.0, 439.0, 440.0, 440.0, 439.0, 439.0, 438.0, 439.0, 439.0, 438.0, 439.0, 438.0, 439.0, 438.0, 438.0, 437.0,
            435.0, 432.0, 429.0, 428.0, 426.0, 426.0, 426.0, 426.0, 427.0, 427.0, 428.0, 429.0, 428.0, 427.0, 427.0, 425.0,
            424.0, 423.0, 420.0, 419.0, 415.0, 413.0, 410.0, 408.0, 405.0, 402.0, 399.0, 396.0, 393.0, 387.0, 381.0, 379.0

          ]
        }
      ]
    },
    {
      "date_array": "27-10-25",
      "day_type": "Normal Day",
      "adjustments": [
        {
          "range": [0, 95],
          "replace":[
            374.0, 370.0, 364.0, 359.0, 354.0, 349.0, 343.0, 340.0, 337.0, 334.0, 331.0,
            328.0, 327.0, 324.0, 322.0, 321.0, 320.0, 319.0, 319.0, 321.0, 322.0, 325.0,
            330.0, 335.0, 344.0, 353.0, 363.0, 376.0, 400.0, 417.0, 436.0, 452.0, 474.0,
            496.0, 515.0, 535.0, 550.0, 560.0, 570.0, 581.0, 589.0, 593.0, 595.0, 600.0,
            600.0, 601.0, 601.0, 599.0, 602.0, 599.0, 597.0, 593.0, 586.0, 587.0, 587.0,
            589.0, 592.0, 595.0, 596.0, 598.0, 597.0, 598.0, 596.0, 597.0, 598.0, 590.0,
            589.0, 586.0, 582.0, 575.0, 567.0, 560.0, 556.0, 551.0, 550.0, 544.0, 536.0,
            528.0, 518.0, 508.0, 494.0, 487.0, 481.0, 479.0, 473.0, 466.0, 457.0, 454.0,
            445.0, 438.0, 432.0, 428.0, 422.0, 415.0, 408.0, 403.0
          ]

        }
      ]
    },
    {
      "date_array": "28-10-25",
      "day_type": "Normal Day",
      "adjustments": [
        {
          "range": [0, 95],
          "replace":[
          395.0, 387.0, 379.0, 375.0, 369.0, 364.0, 358.0, 352.0, 348.0, 344.0, 343.0, 339.0, 
          337.0, 333.0, 329.0, 325.0, 323.0, 323.0, 326.0, 327.0, 330.0, 329.0, 336.0, 343.0, 
          357.0, 367.0, 378.0, 391.0, 405.0, 418.0, 433.0, 452.0, 475.0, 495.0, 511.0, 529.0, 
          543.0, 554.0, 566.0, 573.0, 582.0, 587.0, 594.0, 595.0, 597.0, 602.0, 600.0, 600.0, 
          601.0, 603.0, 601.0, 599.0, 596.0, 594.0, 594.0, 594.0, 595.0, 599.0, 602.0, 609.0, 
          610.0, 610.0, 610.0, 603.0, 602.0, 597.0, 594.0, 590.0, 587.0, 582.0, 572.0, 569.0, 
          565.0, 560.0, 556.0, 548.0, 539.0, 528.0, 519.0, 509.0, 499.0, 491.0, 489.0, 485.0, 
          478.0, 472.0, 466.0, 462.0, 457.0, 452.0, 441.0, 435.0, 430.0, 424.0, 411.0, 403.0
         ]
        }
      ]
    },
    {
      "date_array": "29-10-25",
      "day_type": "Normal Day",
      "adjustments": [
        {
          "range": [0, 95],
          "replace":[
          400.0, 394.0, 388.0, 384.0, 378.0, 374.0, 366.0, 360.0, 355.0, 354.0, 
          352.0, 348.0, 346.0, 342.0, 338.0, 334.0, 333.0, 333.0, 335.0, 333.0, 
          335.0, 339.0, 343.0, 347.0, 360.0, 368.0, 379.0, 393.0, 407.0, 424.0, 
          443.0, 464.0, 489.0, 511.0, 527.0, 545.0, 564.0, 578.0, 589.0, 598.0, 
          599.0, 608.0, 611.0, 622.0, 620.0, 620.0, 617.0, 616.0, 617.0, 620.0, 
          619.0, 619.0, 615.0, 613.0, 608.0, 612.0, 616.0, 623.0, 621.0, 624.0, 
          625.0, 626.0, 626.0, 626.0, 624.0, 619.0, 613.0, 605.0, 600.0, 598.0, 
          591.0, 587.0, 582.0, 570.0, 564.0, 556.0, 541.0, 535.0, 525.0, 516.0, 
          507.0, 499.0, 494.0, 488.0, 484.0, 477.0, 469.0, 464.0, 456.0, 449.0, 
          443.0, 436.0, 432.0, 426.0, 419.0, 410.0
         ]
        }
      ]
    },
    {
      "date_array": "05-11-25",
      "day_type": "Normal Day",
      "adjustments": [
        {
          "range": [0, 95],
          "replace":[
           364.0, 359.0, 352.0, 346.0, 341.0, 334.0, 329.0, 325.0, 322.0, 318.0, 314.0, 312.0, 309.0, 307.0, 305.0,
            304.0, 303.0, 301.0, 302.0, 304.0, 305.0, 309.0, 313.0, 318.0, 325.0, 333.0, 342.0, 354.0, 367.0, 381.0,
            398.0, 416.0, 438.0, 459.0, 476.0, 493.0, 503.0, 512.0, 523.0, 534.0, 540.0, 544.0, 552.0, 555.0, 554.0,
            556.0, 559.0, 558.0, 558.0, 559.0, 556.0, 552.0, 551.0, 548.0, 548.0, 549.0, 551.0, 554.0, 556.0, 555.0,
            555.0, 555.0, 553.0, 550.0, 550.0, 547.0, 545.0, 541.0, 538.0, 532.0, 527.0, 520.0, 512.0, 505.0, 498.0,
            492.0, 485.0, 480.0, 475.0, 469.0, 462.0, 456.0, 452.0, 445.0, 441.0, 438.0, 434.0, 430.0, 426.0, 423.0,
            417.0, 415.0, 411.0, 405.0, 403.0, 393.0
         ]
        }
      ]
    },
    {
      "date_array": "27-11-25",
      "day_type": "Normal Day",
      "adjustments": [
        {
          "range": [0, 95],
          "replace":[
           359.0, 352.0, 345.0, 343.0, 336.0, 332.0, 328.0, 323.0, 319.0, 317.0,
          314.0, 312.0, 308.0, 309.0, 304.0, 302.0, 302.0, 304.0, 304.0, 307.0,
          311.0, 313.0, 318.0, 325.0, 341.0, 349.0, 364.0, 373.0, 385.0, 397.0,
          412.0, 429.0, 451.0, 469.0, 486.0, 501.0, 515.0, 527.0, 536.0, 547.0,
          557.0, 566.0, 573.0, 574.0, 575.0, 576.0, 579.0, 581.0, 583.0, 582.0,
          584.0, 583.0, 578.0, 576.0, 575.0, 576.0, 580.0, 579.0, 580.0, 582.0,
          584.0, 582.0, 580.0, 574.0, 574.0, 567.0, 564.0, 559.0, 560.0, 557.0,
          552.0, 552.0, 549.0, 542.0, 536.0, 527.0, 520.0, 511.0, 501.0, 492.0,
          481.0, 474.0, 468.0, 465.0, 460.0, 455.0, 448.0, 439.0, 433.0, 424.0,
          420.0, 414.0, 408.0, 399.0, 391.0, 386.0
         ]
        }
      ]
    },
    {
      "date_array": "28-11-25",
      "day_type": "Normal Day",
      "adjustments": [
        {
          "range": [0, 95],
          "replace":[
          373.0, 365.0, 359.0, 354.0, 349.0, 344.0, 339.0, 335.0, 332.0, 329.0, 326.0, 323.0, 321.0, 319.0, 317.0, 316.0, 315.0,
        317.0, 319.0, 322.0, 325.0, 331.0, 335.0, 343.0, 352.0, 365.0, 379.0, 392.0, 404.0, 419.0, 433.0, 451.0, 469.0, 489.0,
        509.0, 523.0, 539.0, 551.0, 562.0, 569.0, 575.0, 579.0, 581.0, 583.0, 586.0, 584.0, 583.0, 580.0, 582.0, 581.0, 580.0,
        579.0, 577.0, 576.0, 578.0, 579.0, 579.0, 581.0, 583.0, 586.0, 585.0, 582.0, 581.0, 579.0, 577.0, 576.0, 573.0, 567.0,
        564.0, 562.0, 558.0, 556.0, 553.0, 549.0, 543.0, 535.0, 524.0, 515.0, 505.0, 499.0, 488.0, 478.0, 473.0, 468.0, 463.0,
        458.0, 452.0, 443.0, 437.0, 430.0, 424.0, 418.0, 412.0, 403.0, 395.0, 390.0
         ]
        }
      ]
    },
    {
      "date_array": "01-12-25",
      "day_type": "Normal Day",
      "adjustments": [
        {
          "range": [0, 95],
          "replace":[
          343.0, 341.0, 335.0, 329.0, 324.0, 320.0, 316.0, 312.0, 310.0, 308.0,305.0, 302.0, 300.0, 299.0, 297.0, 297.0, 297.0, 296.0, 297.0, 299.0,
        301.0, 304.0, 309.0, 315.0, 322.0, 332.0, 342.0, 354.0, 368.0, 382.0,398.0, 415.0, 433.0, 452.0, 470.0, 485.0, 499.0, 510.0, 521.0, 531.0,
        538.0, 543.0, 548.0, 551.0, 553.0, 549.0, 546.0, 545.0, 544.0, 542.0,541.0, 540.0, 538.0, 537.0, 536.0, 539.0, 536.0, 540.0, 541.0, 542.0,
        543.0, 546.0, 547.0, 548.0, 543.0, 539.0, 535.0, 533.0, 532.0, 530.0,527.0, 523.0, 517.0, 513.0, 507.0, 500.0, 492.0, 482.0, 472.0, 464.0,
        458.0, 450.0, 444.0, 438.0, 430.0, 424.0, 418.0, 414.0, 407.0, 402.0,397.0, 391.0, 384.0, 378.0, 370.0, 363.0
         ]
        }
      ]
    },
    {
      "date_array": "02-12-25",
      "day_type": "Normal Day",
      "adjustments": [
        {
          "range": [0, 95],
          "replace":[
          322.0, 325.0, 316.0, 313.0, 308.0, 305.0, 301.0, 300.0, 297.0, 296.0,293.0, 291.0, 289.0, 287.0, 284.0, 283.0, 282.0, 281.0, 281.0, 282.0,
          285.0, 290.0, 296.0, 303.0, 313.0, 324.0, 336.0, 348.0, 361.0, 376.0,392.0, 410.0, 427.0, 443.0, 460.0, 474.0, 482.0, 493.0, 505.0, 512.0,
          519.0, 523.0, 524.0, 527.0, 530.0, 532.0, 532.0, 534.0, 532.0, 529.0,527.0, 527.0, 526.0, 526.0, 523.0, 527.0, 525.0, 524.0, 527.0, 532.0,
          531.0, 532.0, 530.0, 526.0, 525.0, 522.0, 517.0, 516.0, 513.0, 510.0,507.0, 506.0, 503.0, 499.0, 491.0, 483.0, 475.0, 464.0, 456.0, 449.0,
          442.0, 434.0, 430.0, 423.0, 417.0, 412.0, 405.0, 398.0, 392.0, 386.0,379.0, 373.0, 369.0, 364.0, 361.0, 355.0
         ]
        }
      ]
    },
    {
      "date_array": "03-12-25",
      "day_type": "Normal Day",
      "adjustments": [
        {
          "range": [0, 95],
          "replace":[
          325.0, 319.0, 315.0, 310.0, 306.0, 304.0, 302.0, 300.0, 298.0, 295.0,293.0, 292.0, 289.0, 287.0, 284.0, 283.0, 284.0, 287.0, 288.0, 289.0,
          290.0, 294.0, 300.0, 307.0, 322.0, 332.0, 346.0, 355.0, 366.0, 377.0,392.0, 404.0, 424.0, 441.0, 456.0, 471.0, 482.0, 491.0, 497.0, 502.0,
          508.0, 515.0, 517.0, 522.0, 524.0, 527.0, 524.0, 526.0, 525.0, 527.0,523.0, 522.0, 520.0, 517.0, 514.0, 517.0, 520.0, 521.0, 523.0, 526.0,
          524.0, 523.0, 526.0, 528.0, 523.0, 520.0, 517.0, 514.0, 513.0, 511.0,509.0, 506.0, 508.0, 505.0, 497.0, 488.0, 482.0, 472.0, 465.0, 456.0,
          449.0, 442.0, 434.0, 428.0, 422.0, 418.0, 410.0, 403.0, 397.0, 391.0,384.0, 378.0, 374.0, 369.0, 366.0, 360.0
         ]
        }
      ]
    },
    {
      "date_array": "IN27-10-25",
      "day_type": "Normal Day",
      "prediction_method": "IntraDay",
      "adjustments": [
        {
          "range": [0, 95],
          "replace":[
          373.0, 369.0, 362.0, 358.0, 351.0, 349.0, 342.0, 338.0, 335.0, 331.0, 329.0, 326.0,
          326.0, 322.0, 318.0, 317.0, 316.0, 318.0, 320.0, 320.0, 322.0, 324.0, 329.0, 337.0,
          351.0, 361.0, 374.0, 388.0, 402.0, 421.0, 438.0, 454.0, 478.0, 501.0, 519.0, 538.0,
          554.0, 564.0, 574.0, 586.0, 594.0, 595.0, 599.0, 604.0, 604.0, 605.0, 602.0, 599.0,
          606.0, 602.0, 601.0, 597.0, 590.0, 591.0, 591.0, 593.0, 596.0, 599.0, 600.0, 602.0,
          601.0, 602.0, 600.0, 601.0, 602.0, 594.0, 593.0, 590.0, 586.0, 579.0, 571.0, 564.0,
          560.0, 555.0, 554.0, 549.0, 541.0, 529.0, 519.0, 508.0, 498.0, 491.0, 485.0, 483.0,
          477.0, 471.0, 465.0, 458.0, 451.0, 442.0, 439.0, 432.0, 426.0, 419.0, 413.0, 405.0
         ]
        }
      ]
    },
    {
      "date_array": "IN28-10-25",
      "day_type": "Normal Day",
      "prediction_method": "IntraDay",
      "adjustments": [
        {
          "range": [0, 95],
          "replace":[
          395.0, 387.0, 379.0, 375.0, 369.0, 364.0, 358.0, 352.0, 348.0, 344.0, 343.0, 339.0, 337.0, 333.0, 329.0, 325.0,
          323.0, 323.0, 326.0, 327.0, 330.0, 329.0, 336.0, 343.0, 357.0, 367.0, 378.0, 391.0, 405.0, 426.0, 442.0, 462.0,
          481.0, 502.0, 519.0, 536.0, 552.0, 566.0, 576.0, 587.0, 596.0, 601.0, 604.0, 607.0, 608.0, 608.0, 608.0, 608.0,
          608.0, 607.0, 606.0, 605.0, 603.0, 601.0, 601.0, 601.0, 602.0, 604.0, 605.0, 606.0, 606.0, 606.0, 604.0, 602.0,
          598.0, 594.0, 590.0, 587.0, 582.0, 578.0, 573.0, 567.0, 559.0, 554.0, 548.0, 541.0, 534.0, 526.0, 517.0, 510.0,
          503.0, 496.0, 490.0, 485.0, 478.0, 472.0, 466.0, 462.0, 457.0, 452.0, 447.0, 443.0, 437.0, 433.0, 427.0, 424.0
         ]
        }
      ]
    },
    {
      "date_array": "IN29-10-25",
      "day_type": "Normal Day",
      "prediction_method": "IntraDay",
      "adjustments": [
        {
          "range": [0, 95],
          "replace":[
          404.0, 398.0, 392.0, 388.0, 382.0, 378.0, 370.0, 364.0, 359.0, 358.0,
          356.0, 352.0, 350.0, 346.0, 342.0, 338.0, 337.0, 337.0, 339.0, 337.0,
          339.0, 343.0, 347.0, 351.0, 364.0, 372.0, 383.0, 397.0, 411.0, 428.0,
          447.0, 468.0, 493.0, 515.0, 531.0, 549.0, 568.0, 582.0, 593.0, 602.0,
          606.0, 615.0, 618.0, 629.0, 627.0, 627.0, 624.0, 623.0, 624.0, 627.0,
          626.0, 626.0, 622.0, 620.0, 615.0, 619.0, 623.0, 630.0, 628.0, 631.0,
          632.0, 633.0, 633.0, 633.0, 631.0, 626.0, 620.0, 612.0, 607.0, 605.0,
          598.0, 594.0, 589.0, 577.0, 571.0, 563.0, 548.0, 542.0, 532.0, 522.0,
          513.0, 505.0, 500.0, 494.0, 490.0, 483.0, 475.0, 470.0, 462.0, 455.0,
          449.0, 442.0, 438.0, 432.0, 425.0, 416.0
         ]
        }
      ]
    },
    {
      "date_array": "IN12-12-25",
      "day_type": "Normal Day",
      "prediction_method": "IntraDay",
      "adjustments": [
        {"range": [0, 35], "increment": -0},
        {"range": [36,40], "increment": -9},
        {"range": [41,43], "increment": -14},
        {"range": [44,50], "increment": -18},
        {"range": [51,58], "increment": -19},
        {"range": [59,65], "increment": -15},
        {"range": [66,70], "increment": -14},
        {"range": [71,75], "increment": -12},
        {"range": [76,95], "increment": -9}
      ]
    }

    


  ]
    }